{"id":"9d8c7b6a-5f4e-4d3c-b2a1-0f9e8d7c6b5a","state":"invalidated","scope":{"kind":"archive","admission":"quarantine"},"snapshotSeq":41,"createdAt":"2026-10-09T10:00:00.000Z","expiresAt":"2026-10-16T10:00:00.000Z","counts":null,"omissions":null,"invalidatedReason":"admission_changed","failureCode":null}
