{"id":"9d8c7b6a-5f4e-4d3c-b2a1-0f9e8d7c6b5a","state":"ready","scope":{"kind":"sources","admission":"normal","sourceIds":["3f9a1c2e-5b7d-4e8f-9a0b-1c2d3e4f5a6b","7c1d2e3f-4a5b-4c6d-8e7f-9a0b1c2d3e4f"]},"snapshotSeq":41,"createdAt":"2026-10-09T10:00:00.000Z","expiresAt":"2026-10-16T10:00:00.000Z","counts":{"sources":2,"attachments":1,"concerns":1,"rules":0,"services":0},"omissions":[{"sourceId":"7c1d2e3f-4a5b-4c6d-8e7f-9a0b1c2d3e4f","reason":"excluded_by_admission"}],"invalidatedReason":null,"failureCode":null}
